{
  "$schema": "https://dojocho.ai/schema/v1/dojo.json",
  "name": "@dojocho/effect-ts",
  "version": "0.0.1",
  "description": "Master Effect-TS through 40 hands-on katas",

  "test": "pnpm vitest run {template}",
  "katas": [
    { "template": "katas/001-hello-effect/solution.ts" },
    { "template": "katas/002-transform-with-map/solution.ts" },
    { "template": "katas/003-generator-pipelines/solution.ts" },
    { "template": "katas/004-flatmap-and-chaining/solution.ts" },
    { "template": "katas/005-pipe-composition/solution.ts" },
    { "template": "katas/006-handle-errors/solution.ts" },
    { "template": "katas/007-tagged-errors/solution.ts" },
    { "template": "katas/008-error-patterns/solution.ts" },
    { "template": "katas/009-option-type/solution.ts" },
    { "template": "katas/010-either-and-exit/solution.ts" },
    { "template": "katas/011-services-and-context/solution.ts" },
    { "template": "katas/012-layers/solution.ts" },
    { "template": "katas/013-testing-effects/solution.ts" },
    { "template": "katas/014-schema-basics/solution.ts" },
    { "template": "katas/015-domain-modeling/solution.ts" },
    { "template": "katas/016-retry-and-schedule/solution.ts" },
    { "template": "katas/017-parallel-effects/solution.ts" },
    { "template": "katas/018-race-and-timeout/solution.ts" },
    { "template": "katas/019-ref-and-state/solution.ts" },
    { "template": "katas/020-fibers/solution.ts" },
    { "template": "katas/021-acquire-release/solution.ts" },
    { "template": "katas/022-scoped-layers/solution.ts" },
    { "template": "katas/023-resource-patterns/solution.ts" },
    { "template": "katas/024-streams-basics/solution.ts" },
    { "template": "katas/025-stream-operations/solution.ts" },
    { "template": "katas/026-combining-streams/solution.ts" },
    { "template": "katas/027-data-pipelines/solution.ts" },
    { "template": "katas/028-logging-and-spans/solution.ts" },
    { "template": "katas/029-http-client/solution.ts" },
    { "template": "katas/030-capstone/solution.ts", "test": "pnpm vitest run katas/" },
    { "template": "katas/031-config-and-environment/solution.ts" },
    { "template": "katas/032-cause-and-defects/solution.ts" },
    { "template": "katas/033-pattern-matching/solution.ts" },
    { "template": "katas/034-deferred-and-coordination/solution.ts" },
    { "template": "katas/035-queue-and-backpressure/solution.ts" },
    { "template": "katas/036-schema-advanced/solution.ts" },
    { "template": "katas/037-cache-and-memoization/solution.ts" },
    { "template": "katas/038-metrics/solution.ts" },
    { "template": "katas/039-managed-runtime/solution.ts" },
    { "template": "katas/040-request-batching/solution.ts", "test": "pnpm vitest run katas/" }
  ]
}
