{
  "$schema": "https://dojocho.ai/schema/v1/dojo.json",
  "name": "@dojocho/build-llm",
  "version": "0.0.1",
  "description": "Build a Large Language Model \u2014 and a Reasoning Model \u2014 from scratch. 23 chapters / appendices, ~114 katas. Companion to Raschka's two books.",
  "runner": {
    "adapter": "exit-code"
  },
  "test": "uv run pytest {template} -v",
  "katas": [
    {
      "template": "katas/001-bigram-language-model/solution.py"
    },
    {
      "template": "katas/002-autoregressive-generation/solution.py"
    },
    {
      "template": "katas/003-encoder-vs-decoder/solution.py"
    },
    {
      "template": "katas/004-training-pairs-from-text/solution.py"
    },
    {
      "template": "katas/005-simple-regex-tokenizer/solution.py"
    },
    {
      "template": "katas/006-tokenizer-with-special-tokens/solution.py"
    },
    {
      "template": "katas/007-bpe-via-tiktoken/solution.py"
    },
    {
      "template": "katas/008-gpt-dataset/solution.py"
    },
    {
      "template": "katas/009-embeddings-and-lookup/solution.py"
    },
    {
      "template": "katas/010-positional-embeddings/solution.py"
    },
    {
      "template": "katas/011-simplified-self-attention/solution.py"
    },
    {
      "template": "katas/012-qkv-projections/solution.py"
    },
    {
      "template": "katas/013-scaled-dot-product-attention/solution.py"
    },
    {
      "template": "katas/014-causal-attention-mask/solution.py"
    },
    {
      "template": "katas/015-multihead-attention-naive/solution.py"
    },
    {
      "template": "katas/016-multihead-attention-efficient/solution.py"
    },
    {
      "template": "katas/017-attention-mingpt-vs-raschka/solution.py"
    },
    {
      "template": "katas/018-layer-norm/solution.py"
    },
    {
      "template": "katas/019-gelu/solution.py"
    },
    {
      "template": "katas/020-feed-forward/solution.py"
    },
    {
      "template": "katas/021-residual-connections/solution.py"
    },
    {
      "template": "katas/022-transformer-block/solution.py"
    },
    {
      "template": "katas/023-full-gpt-model/solution.py"
    },
    {
      "template": "katas/024-weight-tying/solution.py"
    },
    {
      "template": "katas/025-cross-entropy-from-logits/solution.py"
    },
    {
      "template": "katas/026-perplexity/solution.py"
    },
    {
      "template": "katas/027-training-loop/solution.py"
    },
    {
      "template": "katas/028-train-val-split-with-divergence-detect/solution.py"
    },
    {
      "template": "katas/029-decoding-strategies/solution.py"
    },
    {
      "template": "katas/030-checkpoint-save-resume/solution.py"
    },
    {
      "template": "katas/031-classification-head-swap/solution.py"
    },
    {
      "template": "katas/032-last-token-vs-pooling/solution.py"
    },
    {
      "template": "katas/033-freeze-unfreeze-verify/solution.py"
    },
    {
      "template": "katas/034-classification-train-step/solution.py"
    },
    {
      "template": "katas/035-gradual-unfreezing/solution.py"
    },
    {
      "template": "katas/036-alpaca-prompt-template/solution.py"
    },
    {
      "template": "katas/037-prompt-template-strategies/solution.py"
    },
    {
      "template": "katas/038-instruction-dataset/solution.py"
    },
    {
      "template": "katas/039-masked-loss/solution.py"
    },
    {
      "template": "katas/040-instruction-train-step/solution.py"
    },
    {
      "template": "katas/041-tensor-basics/solution.py"
    },
    {
      "template": "katas/042-broadcasting/solution.py"
    },
    {
      "template": "katas/043-autograd-hand-vs-machine/solution.py"
    },
    {
      "template": "katas/044-nn-module-subclass/solution.py"
    },
    {
      "template": "katas/045-train-xor-mlp/solution.py"
    },
    {
      "template": "katas/046-dataset-dataloader-device/solution.py"
    },
    {
      "template": "katas/047-lr-warmup/solution.py"
    },
    {
      "template": "katas/048-cosine-decay/solution.py"
    },
    {
      "template": "katas/049-warmup-then-cosine/solution.py"
    },
    {
      "template": "katas/050-gradient-clip-global-norm/solution.py"
    },
    {
      "template": "katas/051-lora-linear-layer/solution.py"
    },
    {
      "template": "katas/052-lora-parameter-count/solution.py"
    },
    {
      "template": "katas/053-loraify-model/solution.py"
    },
    {
      "template": "katas/054-lora-merge/solution.py"
    },
    {
      "template": "katas/055-lora-train-vs-full/solution.py"
    },
    {
      "template": "katas/056-pattern-match-vs-reasoning/solution.py"
    },
    {
      "template": "katas/057-chain-of-thought-scorer/solution.py"
    },
    {
      "template": "katas/058-inference-vs-training-tradeoff/solution.py"
    },
    {
      "template": "katas/059-self-consistency-vote/solution.py"
    },
    {
      "template": "katas/060-greedy-on-tiny-gpt/solution.py"
    },
    {
      "template": "katas/061-qwen-vs-vanilla-attention/solution.py"
    },
    {
      "template": "katas/062-streaming-generation/solution.py"
    },
    {
      "template": "katas/063-kv-cache-attention/solution.py"
    },
    {
      "template": "katas/064-chat-template-qwen/solution.py"
    },
    {
      "template": "katas/065-extract-boxed-answer/solution.py"
    },
    {
      "template": "katas/066-normalize-numeric-answer/solution.py"
    },
    {
      "template": "katas/067-match-answers-layered/solution.py"
    },
    {
      "template": "katas/068-accuracy-on-mini-math/solution.py"
    },
    {
      "template": "katas/069-length-statistics/solution.py"
    },
    {
      "template": "katas/070-majority-vote-aggregator/solution.py"
    },
    {
      "template": "katas/071-weighted-majority/solution.py"
    },
    {
      "template": "katas/072-best-of-n-with-verifier/solution.py"
    },
    {
      "template": "katas/073-self-consistency-end-to-end/solution.py"
    },
    {
      "template": "katas/074-accuracy-vs-samples-sweep/solution.py"
    },
    {
      "template": "katas/075-refinement-loop/solution.py"
    },
    {
      "template": "katas/076-heuristic-scorer/solution.py"
    },
    {
      "template": "katas/077-stopping-criteria/solution.py"
    },
    {
      "template": "katas/078-best-of-refined/solution.py"
    },
    {
      "template": "katas/079-bandit-reward/solution.py"
    },
    {
      "template": "katas/080-policy-gradient-reinforce/solution.py"
    },
    {
      "template": "katas/081-advantage-normalization/solution.py"
    },
    {
      "template": "katas/082-group-relative-advantage/solution.py"
    },
    {
      "template": "katas/083-grpo-loss/solution.py"
    },
    {
      "template": "katas/084-grpo-bandit-training/solution.py"
    },
    {
      "template": "katas/085-kl-divergence-categorical/solution.py"
    },
    {
      "template": "katas/086-kl-penalized-grpo/solution.py"
    },
    {
      "template": "katas/087-adaptive-kl-coefficient/solution.py"
    },
    {
      "template": "katas/088-reward-hacking-detector/solution.py"
    },
    {
      "template": "katas/089-kl-distillation-loss/solution.py"
    },
    {
      "template": "katas/090-combined-distillation-loss/solution.py"
    },
    {
      "template": "katas/091-train-student-distill/solution.py"
    },
    {
      "template": "katas/092-response-distillation-dataset/solution.py"
    },
    {
      "template": "katas/093-rms-norm/solution.py"
    },
    {
      "template": "katas/094-rotary-positional-embeddings/solution.py"
    },
    {
      "template": "katas/095-grouped-query-attention/solution.py"
    },
    {
      "template": "katas/096-swiglu-ffn/solution.py"
    },
    {
      "template": "katas/097-tiny-qwen-block/solution.py"
    },
    {
      "template": "katas/098-model-memory-footprint/solution.py"
    },
    {
      "template": "katas/099-int8-quantization-roundtrip/solution.py"
    },
    {
      "template": "katas/100-group-quantization/solution.py"
    },
    {
      "template": "katas/101-model-parallel-2device/solution.py"
    },
    {
      "template": "katas/102-padding-waste/solution.py"
    },
    {
      "template": "katas/103-dynamic-batch-pack/solution.py"
    },
    {
      "template": "katas/104-continuous-batching-sim/solution.py"
    },
    {
      "template": "katas/105-paged-kv-cache/solution.py"
    },
    {
      "template": "katas/106-exact-match-and-f1/solution.py"
    },
    {
      "template": "katas/107-bradley-terry-rating/solution.py"
    },
    {
      "template": "katas/108-elo-rating/solution.py"
    },
    {
      "template": "katas/109-llm-judge-mock/solution.py"
    },
    {
      "template": "katas/110-win-rate-with-ci/solution.py"
    },
    {
      "template": "katas/111-chat-session-class/solution.py"
    },
    {
      "template": "katas/112-truncation-strategies/solution.py"
    },
    {
      "template": "katas/113-streaming-chat/solution.py"
    },
    {
      "template": "katas/114-cli-chat-loop/solution.py"
    }
  ]
}
